{
  "topic": "Hormuz Strait tanker incident",
  "evidence_mode": "live_source_backed",
  "source_category": "conflict-security",
  "claims": [
    {
      "claim": "IRGC Navy seized a commercial tanker in the Strait of Hormuz.",
      "support_status": "supported",
      "sources": [
        {
          "name": "UKMTO advisory and flag state statement",
          "url": "https://www.ukmto.org/",
          "source_type": "official",
          "freshness": "current",
          "supports": [
            "Incident confirmation, vessel details, location"
          ],
          "limits": [
            "Does not assess pattern probability"
          ]
        }
      ]
    },
    {
      "claim": "Hormuz handles approximately 20% of global oil trade.",
      "support_status": "supported",
      "sources": [
        {
          "name": "EIA Hormuz Strait chokepoint analysis",
          "url": "https://www.eia.gov/international/analysis/regions-of-interest/Strait_of_Hormuz",
          "source_type": "official",
          "freshness": "current",
          "supports": [
            "Oil flow volume data"
          ],
          "limits": [
            "Data may lag current quarter"
          ]
        }
      ]
    },
    {
      "claim": "War-risk premiums likely to increase.",
      "support_status": "partially_supported",
      "sources": [
        {
          "name": "UKMTO advisory and flag state statement",
          "url": "https://www.ukmto.org/",
          "source_type": "official",
          "freshness": "current",
          "supports": [
            "Incident confirmation, vessel details, location"
          ],
          "limits": [
            "Does not assess pattern probability"
          ]
        }
      ]
    }
  ],
  "unsupported_claims": [
    "IRGC strategic intent",
    "Resolution timeline"
  ],
  "retrieved_at": "2026-05-19T12:00:00Z"
}
