{
  "topic": "Turkey local election results",
  "evidence_mode": "live_source_backed",
  "source_category": "elections",
  "claims": [
    {
      "claim": "Opposition won mayoralties in Istanbul and Ankara.",
      "support_status": "supported",
      "sources": [
        {
          "name": "Turkey Supreme Election Council results",
          "url": "https://www.ysk.gov.tr/",
          "source_type": "official",
          "freshness": "current",
          "supports": [
            "Official election results by city"
          ],
          "limits": [
            "Preliminary; final certification follows challenge period"
          ]
        }
      ]
    }
  ],
  "unsupported_claims": [
    "National policy implications",
    "Foreign investor reaction magnitude"
  ],
  "retrieved_at": "2026-05-19T12:00:00Z"
}
